{
  "schemaVersion": "1",
  "id": "d6e7f8a9-b0c1-2345-9012-456789012345",
  "name": "Meta (Facebook) Pixel & Conversions API",
  "description": "fbevents.js, /tr pixel hits, Graph API marketing endpoints, and server-side CAPI calls.",
  "methodology": "Extract pixel ID and event names. CAPI may hit graph.facebook.com from your backend—review access tokens and deduplication with browser pixel. Validate consent (Limited Data Use, etc.) for regulated regions.",
  "patterns": [
    "[^/]*connect\\.facebook\\.net/.*",
    "[^/]*www\\.facebook\\.com/tr.*",
    "[^/]*facebook\\.com/tr.*",
    "[^/]*graph\\.facebook\\.com/.*",
    "[^/]*pixel\\.facebook\\.com/.*"
  ],
  "tlsPassThrough": false
}
